{
  "$schema": "https://json-schema.org/draft/2020-12/schema",
  "$id": "https://platform.invalid/contracts/snapshot.v1.schema.json",
  "title": "Site capture snapshot.v1",
  "type": "object",
  "additionalProperties": false,
  "required": ["schemaVersion", "capture", "pages", "diagnostics"],
  "properties": {
    "schemaVersion": { "const": "snapshot.v1" },
    "capture": {
      "type": "object",
      "required": [
        "targetUrl",
        "origin",
        "capturedAt",
        "localOnly",
        "redacted",
        "contentTreatment",
        "crawler",
        "policy",
        "robots",
        "viewports"
      ],
      "properties": {
        "targetUrl": { "type": "string", "format": "uri" },
        "origin": { "type": "string", "format": "uri" },
        "capturedAt": { "type": "string", "format": "date-time" },
        "localOnly": { "const": true },
        "redacted": { "type": "boolean" },
        "redaction": { "type": "object" },
        "contentTreatment": { "type": "string" },
        "crawler": { "type": "object" },
        "policy": { "type": "object" },
        "robots": { "type": "object" },
        "viewports": { "type": "array", "minItems": 1, "items": { "type": "object" } }
      }
    },
    "pages": {
      "type": "array",
      "items": {
        "type": "object",
        "required": [
          "pageId",
          "requestedUrl",
          "url",
          "path",
          "status",
          "title",
          "outline",
          "blocks",
          "assets",
          "navigation",
          "discoveredLinks",
          "screenshots"
        ],
        "properties": {
          "pageId": { "type": "string", "pattern": "^page_[a-f0-9]{12}$" },
          "requestedUrl": { "type": "string", "format": "uri" },
          "url": { "type": "string", "format": "uri" },
          "path": { "type": "string" },
          "status": { "type": "integer", "minimum": 100, "maximum": 399 },
          "capturedAt": { "type": "string", "format": "date-time" },
          "title": { "type": "string" },
          "lang": { "type": ["string", "null"] },
          "canonicalUrl": { "type": ["string", "null"] },
          "metaDescription": { "type": ["string", "null"] },
          "outline": { "type": "array", "items": { "type": "object" } },
          "blocks": {
            "type": "array",
            "items": {
              "type": "object",
              "required": [
                "id",
                "ordinal",
                "tag",
                "selector",
                "text",
                "links",
                "boundingBoxes",
                "computedStyles",
                "screenshots",
                "assetUrls"
              ],
              "properties": {
                "id": { "type": "string" },
                "ordinal": { "type": "integer", "minimum": 0 },
                "tag": { "type": "string" },
                "role": { "type": ["string", "null"] },
                "accessibleName": { "type": ["string", "null"] },
                "selector": { "type": "string" },
                "text": { "type": "object" },
            "structure": {
              "type": "object",
              "description": "T12.23: the block's recovered DOM shape — the lists, tables, quotes and question/answer pairs that `text` melts into one flat string. Optional and purely additive: a snapshot without this key maps exactly as it did before, so old snapshots stay replayable. Present only when the block actually contains one of these structures, and bounded at capture time (<=6 groups, <=24 items, <=400 chars per string) because a snapshot is stored and re-read.",
              "properties": {
                "lists": {
                  "type": "array",
                  "items": {
                    "type": "object",
                    "required": ["ordered", "items"],
                    "properties": {
                      "ordered": { "type": "boolean" },
                      "items": { "type": "array", "items": { "type": "string" } }
                    }
                  }
                },
                "tables": {
                  "type": "array",
                  "items": {
                    "type": "object",
                    "required": ["headers", "rows"],
                    "properties": {
                      "headers": { "type": "array", "items": { "type": "string" } },
                      "rows": { "type": "array", "items": { "type": "array", "items": { "type": "string" } } }
                    }
                  }
                },
                "quotes": {
                  "type": "array",
                  "items": {
                    "type": "object",
                    "required": ["quote"],
                    "properties": {
                      "quote": { "type": "string" },
                      "attribution": { "type": "string" }
                    }
                  }
                },
                "qa": {
                  "type": "array",
                  "items": {
                    "type": "object",
                    "required": ["q", "a"],
                    "properties": {
                      "q": { "type": "string" },
                      "a": { "type": "string" }
                    }
                  }
                },
                "gallery": {
                  "type": "object",
                  "description": "T14.2: a repeated figure recovered as ORDERED DISCRETE ITEMS, so a caption stays attached to the picture it describes instead of melting into the block's flat text. Pairing is by CONTAINMENT (an item's caption is text inside that item's own subtree), never by array position. `captions: 'unavailable'` plus a `reason` is emitted when the DOM does not associate them — downstream must then emit no captions rather than guess.",
                  "required": ["sourceCount", "items", "captions"],
                  "properties": {
                    "sourceCount": { "type": "integer", "minimum": 0 },
                    "truncated": { "type": "boolean" },
                    "captions": { "enum": ["per_item", "partial", "unavailable"] },
                    "reason": { "type": "string" },
                    "items": {
                      "type": "array",
                      "items": {
                        "type": "object",
                        "required": ["src"],
                        "properties": {
                          "src": { "type": "string", "format": "uri" },
                          "alt": { "type": ["string", "null"] },
                          "caption": { "type": "string" },
                          "captionSource": { "enum": ["figcaption", "item_text"] },
                          "href": { "type": ["string", "null"] },
                          "intrinsic": {
                            "type": "object",
                            "required": ["width", "height"],
                            "properties": {
                              "width": { "type": "integer", "minimum": 1 },
                              "height": { "type": "integer", "minimum": 1 },
                              "source": { "enum": ["natural", "attribute", "transform"] }
                            }
                          }
                        }
                      }
                    }
                  }
                }
              }
            },
                "links": { "type": "array", "items": { "type": "object" } },
                "boundingBoxes": { "type": "object" },
                "computedStyles": { "type": "object" },
                "screenshots": { "type": "array", "items": { "type": "object" } },
                "assetUrls": { "type": "array", "items": { "type": "string", "format": "uri" } }
              }
            }
          },
          "assets": { "type": "array", "items": { "type": "object" } },
          "navigation": { "type": "object" },
          "discoveredLinks": { "type": "array", "items": { "type": "string", "format": "uri" } },
          "screenshots": { "type": "array", "items": { "type": "object" } }
        }
      }
    },
    "diagnostics": {
      "type": "object",
      "required": ["queuedUrls", "capturedPages", "skipped", "quarantined", "stoppedAtProjectMaxPages"],
      "properties": {
        "queuedUrls": { "type": "integer", "minimum": 0 },
        "capturedPages": { "type": "integer", "minimum": 0 },
        "skipped": { "type": "array" },
        "quarantined": { "type": "array" },
        "stoppedAtProjectMaxPages": { "type": "boolean" }
      }
    }
  }
}
