{
  "schemaVersion": "snapshot.v1",
  "capture": {
    "targetUrl": "https://www.zilbermanfilmfoundation.com/",
    "origin": "https://www.zilbermanfilmfoundation.com",
    "capturedAt": "2026-08-13T12:03:52.902Z",
    "localOnly": true,
    "redacted": true,
    "contentTreatment": "page content was recorded as data and never interpreted as instructions",
    "crawler": {
      "userAgent": "W12CaptureSpike/1.0",
      "browserExecutable": "/Applications/Google Chrome.app/Contents/MacOS/Google Chrome",
      "concurrency": 1,
      "delayMs": 1500
    },
    "policy": {
      "maxPages": 20,
      "allowedCrawlOrigins": [
        "https://www.zilbermanfilmfoundation.com"
      ],
      "allowedPathPrefixes": [
        "/"
      ],
      "sameOriginOnly": true,
      "respectRobots": true,
      "concurrency": 1,
      "delayMs": 1500,
      "authenticatedAccess": "prohibited",
      "rights": {
        "content": "retain_allowed_origin_content",
        "media": "retain_referenced_allowed_origin_media"
      },
      "designReferences": [
        {
          "origin": "https://prconsulting.net",
          "purpose": "design_inspiration_only",
          "crawlAllowed": false,
          "contentReuse": "prohibited",
          "mediaReuse": "prohibited"
        }
      ],
      "fidelity": {
        "mode": "design_inspired",
        "sourceDesignTreatment": "source_content_with_design_inspiration_only"
      }
    },
    "robots": {
      "url": "https://www.zilbermanfilmfoundation.com/robots.txt",
      "status": 200,
      "fetchedAt": "2026-08-13T12:03:00.719Z",
      "sha256": "55d8151b0cfc2521af06081023b3a69e66e36e5bdd091a508c98f3ad2e7bb62d",
      "sitemaps": [
        "https://www.zilbermanfilmfoundation.com/sitemap.xml"
      ],
      "crawlDelayMs": 0,
      "respected": true,
      "sitemapFetches": [
        {
          "url": "https://www.zilbermanfilmfoundation.com/sitemap.xml",
          "status": 200,
          "sha256": "fc034669b857920fc5607ad837ced12bf9abc9751cc296ae323b18b4e5e82aaf",
          "locations": 2
        },
        {
          "url": "https://www.zilbermanfilmfoundation.com/event-pages-sitemap.xml",
          "status": 200,
          "sha256": "797aa7135862819ef78fa76f75a8290a79cd96e7b0aef53931aab7960b7de276",
          "locations": 1
        },
        {
          "url": "https://www.zilbermanfilmfoundation.com/pages-sitemap.xml",
          "status": 200,
          "sha256": "a6fdc3545b5096875dd7b918fc0de5bb9d26a61f58ee999d0e72fcb06f9198ce",
          "locations": 5
        }
      ]
    },
    "viewports": [
      {
        "id": "mobile",
        "width": 390,
        "height": 844,
        "deviceScaleFactor": 1
      },
      {
        "id": "desktop",
        "width": 1440,
        "height": 1000,
        "deviceScaleFactor": 1
      }
    ],
    "redaction": {
      "text": "replaced with length-preserving markers",
      "screenshots": "references retained; binary files omitted",
      "assets": "URL manifest retained; bytes never stored"
    }
  },
  "pages": [
    {
      "pageId": "page_9563b8e16278",
      "requestedUrl": "https://www.zilbermanfilmfoundation.com/",
      "url": "https://www.zilbermanfilmfoundation.com/",
      "path": "/",
      "status": 200,
      "capturedAt": "2026-08-13T12:03:17.812Z",
      "title": "[redacted:47 chars]",
      "lang": "en",
      "canonicalUrl": "https://www.zilbermanfilmfoundation.com/",
      "metaDescription": "[redacted:157 chars]",
      "outline": [
        {
          "tag": "header",
          "role": null,
          "level": null,
          "text": "[redacted:84 chars]",
          "selector": "#SITE_HEADER"
        },
        {
          "tag": "section",
          "role": null,
          "level": null,
          "text": "[redacted:84 chars]",
          "selector": "#comp-lfva20u2"
        },
        {
          "tag": "nav",
          "role": null,
          "level": null,
          "text": "[redacted:78 chars]",
          "selector": "#comp-lfva214vnavContainer"
        },
        {
          "tag": "main",
          "role": null,
          "level": null,
          "text": "[redacted:500 chars]",
          "selector": "#PAGES_CONTAINER"
        },
        {
          "tag": "section",
          "role": null,
          "level": null,
          "text": "[redacted:163 chars]",
          "selector": "#comp-lfva27bj"
        },
        {
          "tag": "section",
          "role": null,
          "level": null,
          "text": "[redacted:163 chars]",
          "selector": "#comp-lfva21rg"
        },
        {
          "tag": "section",
          "role": null,
          "level": null,
          "text": "[redacted:163 chars]",
          "selector": "#comp-lfva21rh"
        },
        {
          "tag": "h1",
          "role": null,
          "level": 1,
          "text": "[redacted:20 chars]",
          "selector": "html > body > div > div > div:nth-of-type(3) > div > main > div > div > div > div:nth-of-type(2) > div > div > div > section:nth-of-type(1) > div:nth-of-type(2) > div > section > div:nth-of-type(2) > div > div:nth-of-type(2) > div > section > div:nth-of-type(2) > div > div:nth-of-type(2) > div > div:nth-of-type(1) > div > div > div:nth-of-type(2) > h1"
        },
        {
          "tag": "section",
          "role": null,
          "level": null,
          "text": "[redacted:500 chars]",
          "selector": "#comp-lfva27rv"
        },
        {
          "tag": "section",
          "role": null,
          "level": null,
          "text": "[redacted:500 chars]",
          "selector": "#comp-lfva21rm1"
        },
        {
          "tag": "section",
          "role": null,
          "level": null,
          "text": "[redacted:500 chars]",
          "selector": "#comp-lfva21rn"
        },
        {
          "tag": "section",
          "role": null,
          "level": null,
          "text": "[redacted:500 chars]",
          "selector": "#comp-lfwgpzkm"
        },
        {
          "tag": "section",
          "role": null,
          "level": null,
          "text": "[redacted:500 chars]",
          "selector": "#comp-lfwgrs3f"
        },
        {
          "tag": "section",
          "role": null,
          "level": null,
          "text": "[redacted:500 chars]",
          "selector": "#comp-lfwgrs3g1"
        },
        {
          "tag": "section",
          "role": null,
          "level": null,
          "text": "[redacted:500 chars]",
          "selector": "#comp-lfwgu4ur"
        },
        {
          "tag": "h2",
          "role": null,
          "level": 2,
          "text": "[redacted:12 chars]",
          "selector": "html > body > div > div > div:nth-of-type(3) > div > main > div > div > div > div:nth-of-type(2) > div > div > div > section:nth-of-type(4) > div:nth-of-type(2) > div > div:nth-of-type(1) > h2"
        },
        {
          "tag": "div",
          "role": "region",
          "level": null,
          "text": "[redacted:500 chars]",
          "selector": "#comp-lfwgu4xe1"
        },
        {
          "tag": "nav",
          "role": null,
          "level": null,
          "text": "",
          "selector": "html > body > div > div > div:nth-of-type(3) > div > main > div > div > div > div:nth-of-type(2) > div > div > div > section:nth-of-type(4) > div:nth-of-type(2) > div > div:nth-of-type(2) > nav"
        },
        {
          "tag": "section",
          "role": null,
          "level": null,
          "text": "[redacted:52 chars]",
          "selector": "#comp-lgdf70p5"
        },
        {
          "tag": "section",
          "role": null,
          "level": null,
          "text": "[redacted:52 chars]",
          "selector": "#comp-loczwzc1"
        },
        {
          "tag": "h2",
          "role": null,
          "level": 2,
          "text": "[redacted:12 chars]",
          "selector": "html > body > div > div > div:nth-of-type(3) > div > main > div > div > div > div:nth-of-type(2) > div > div > div > section:nth-of-type(5) > div:nth-of-type(3) > div > section > div:nth-of-type(2) > div > div:nth-of-type(2) > div > div:nth-of-type(1) > h2"
        },
        {
          "tag": "section",
          "role": null,
          "level": null,
          "text": "[redacted:50 chars]",
          "selector": "#comp-lfva280c"
        },
        {
          "tag": "section",
          "role": null,
          "level": null,
          "text": "[redacted:50 chars]",
          "selector": "#comp-lfva21rp"
        },
        {
          "tag": "section",
          "role": null,
          "level": null,
          "text": "[redacted:50 chars]",
          "selector": "#comp-lfva21rp2"
        },
        {
          "tag": "h2",
          "role": null,
          "level": 2,
          "text": "[redacted:8 chars]",
          "selector": "html > body > div > div > div:nth-of-type(3) > div > main > div > div > div > div:nth-of-type(2) > div > div > div > section:nth-of-type(6) > div:nth-of-type(2) > div > section > div:nth-of-type(2) > div > div:nth-of-type(2) > div > section > div:nth-of-type(2) > div > div:nth-of-type(2) > div > div:nth-of-type(1) > h2"
        },
        {
          "tag": "footer",
          "role": null,
          "level": null,
          "text": "[redacted:50 chars]",
          "selector": "#SITE_FOOTER"
        }
      ],
      "blocks": [
        {
          "ordinal": 0,
          "tag": "section",
          "role": null,
          "accessibleName": null,
          "selector": "#comp-lfva27bj",
          "text": {
            "value": "[redacted:163 chars]",
            "length": 163,
            "truncated": false
          },
          "links": [
            {
              "label": "[redacted:8 chars]",
              "href": "https://www.zilbermanfilmfoundation.com/s-projects-side-by-side"
            }
          ],
          "boundingBoxes": {
            "mobile": {
              "x": 0,
              "y": 100,
              "width": 980,